id,createdAt,customerEmail,subject,message,channel,language,customerId,os,browser
TICKET-0001,2025-06-09T20:52:22.044306,jimenezamy@stanley.com,Each win suggest pass poor.,Officer country necessary production. Finish she PM night.,email,en,CUST-4818,Linux,Chrome
TICKET-0002,2025-05-28T20:52:22.045263,woliver@crawford-johnson.com,Magazine factor deal glass ready each.,Personal level form process. Administration assume middle director red leader.,email,es,CUST-2055,iOS,Edge
TICKET-0003,2025-05-24T20:52:22.045753,johnnicholson@yahoo.com,World evening chance including war author beat.,Current fear allow learn television. Sort final central indeed. Whole what stop degree live tonight alone.,chat,es,CUST-9962,macOS,Firefox
TICKET-0004,2025-06-07T20:52:22.046051,robertsmary@nash-torres.org,Age involve visit need least nor serious bring.,Trade my either situation statement. Themselves according indicate eat. By factor assume moment meet ability behind.,chat,en,CUST-6305,macOS,Edge
TICKET-0005,2025-05-26T20:52:22.046661,amy32@gmail.com,Manager wonder west offer garden.,Smile spring stop project up leave develop. Ask check anything party foot occur room.,email,en,CUST-9974,Windows,Chrome
TICKET-0006,2025-06-11T20:52:22.046830,devinray@brown.org,Forward miss ask lot measure water half upon.,Reach company call response yard remember business. Artist bag between allow once claim usually.,form,en,CUST-8316,Android,Firefox
TICKET-0007,2025-05-23T20:52:22.047241,cmccormick@walker.com,Determine price skill most true field why.,Son much measure. Site go film final both sell. Require already she test over American read.,form,es,CUST-3776,Android,Firefox
TICKET-0008,2025-06-17T20:52:22.047782,michelle25@hotmail.com,Last sort miss pretty visit.,Their eye believe forward out deep. Mother cut thank commercial yourself somebody.,email,es,CUST-8187,Windows,Firefox
TICKET-0009,2025-06-02T20:52:22.047996,bgonzales@dennis.org,Up project more benefit level risk.,Hand they couple east million store north. Travel popular deal. Store today eat performance.,email,en,CUST-2472,Windows,Safari
TICKET-0010,2025-05-30T20:52:22.048343,williamsmichele@gmail.com,Catch television deep day movement center increase.,Sea write common night material heavy knowledge product. Event four but per.,form,es,CUST-8177,Windows,Safari
TICKET-0011,2025-05-21T20:52:22.048622,elizabeth07@novak.com,Mention bill meeting before cell respond.,Ever summer write store wall. Song Congress brother choice. Detail kind feel seat return once.,form,en,CUST-6162,Linux,Chrome
TICKET-0012,2025-05-22T20:52:22.048883,laura78@garrett.com,Minute person so south.,Research policy pay religious American.,email,en,CUST-6994,macOS,Firefox
TICKET-0013,2025-06-02T20:52:22.049149,jacksonsimmons@gmail.com,These hot beautiful something late.,Build tree training manager trade blood white better. Knowledge conference their end image.,chat,en,CUST-2695,Linux,Safari
TICKET-0014,2025-06-04T20:52:22.049429,moorekarl@richardson-davis.com,Forward exist international food.,Perform month know put. On billion food city local region act. Call director true.,email,es,CUST-5915,macOS,Chrome
TICKET-0015,2025-06-11T20:52:22.049912,katherinetaylor@zavala-sampson.org,Religious put director.,Teacher traditional certain maintain threat eat international.,email,en,CUST-1202,macOS,Safari
TICKET-0016,2025-06-13T20:52:22.050379,myerslarry@harper-arias.net,Take southern now respond modern nation rise.,Every pass wind trial story. Plan foreign water school ground management. Century until five add.,chat,es,CUST-9795,macOS,Safari
TICKET-0017,2025-05-21T20:52:22.050915,johnnunez@hotmail.com,Since student so carry issue hot media.,Property start physical national career.,email,en,CUST-5895,Windows,Safari
TICKET-0018,2025-06-16T20:52:22.051156,kenneth22@archer.biz,Who try ten.,Admit author medical theory part lot. Red there threat small speech. Long family chair picture party.,chat,en,CUST-6896,Android,Safari
TICKET-0019,2025-06-08T20:52:22.051700,andrewballard@wade.com,Policy successful situation.,Run agent way scientist scene carry that. Here relationship white memory.,email,en,CUST-2023,Linux,Safari
TICKET-0020,2025-05-29T20:52:22.052371,regina10@hotmail.com,Record able property wide two true serious.,Address green prove cost plant. Middle person hard hold what down. Unit as trip black full suddenly.,email,en,CUST-1683,macOS,Edge
TICKET-0021,2025-06-05T20:52:22.052533,christopher42@villanueva.info,Huge form man fly agency kid.,Draw anyone contain speech. Style maybe church ask score billion world. Off relationship accept none side son. Though matter technology none.,email,es,CUST-1019,macOS,Safari
TICKET-0022,2025-05-31T20:52:22.052902,emma55@brooks-gonzalez.com,Ability purpose authority probably enjoy available.,Control imagine heavy reduce career success its. Base fire truth economic appear star require participant. Western light somebody media. Itself magazine stop cost.,chat,en,CUST-6852,Linux,Chrome
TICKET-0023,2025-05-31T20:52:22.053270,raymond10@gmail.com,Consumer after these again free middle contain.,Receive create method. Lot happen Mr itself together near near. Leave rest than lot.,form,es,CUST-5659,Android,Safari
TICKET-0024,2025-06-13T20:52:22.053423,chad05@gmail.com,Thought leave surface huge try face.,Page boy good soon data future. Identify occur marriage positive.,email,en,CUST-4056,iOS,Edge
TICKET-0025,2025-06-10T20:52:22.053573,calhounjames@yahoo.com,Left kind while PM.,Skill ok themselves spend general. Finally generation when least later daughter choose. Player newspaper or responsibility allow rather.,email,es,CUST-6352,Android,Edge
